{
  "$schema": "http://json-schema.org/draft-07/schema#",
  "title": "RAMPBackupManifest",
  "type": "object",
  "required": [
    "backup_id",
    "created_at",
    "target_components",
    "archive_filename",
    "archive_sha256",
    "file_count",
    "total_size_bytes",
    "is_verified"
  ],
  "properties": {
    "backup_id": { "type": "string" },
    "created_at": { "type": "string" },
    "target_components": {
      "type": "array",
      "items": { "type": "string" }
    },
    "archive_filename": { "type": "string" },
    "archive_sha256": { "type": "string" },
    "file_count": { "type": "integer" },
    "total_size_bytes": { "type": "integer" },
    "is_verified": { "type": "boolean" },
    "metadata": { "type": "object" }
  }
}
