{
  "backup_id": "BKP_20260926_210444",
  "created_at": "2026-09-26T21:04:44.542785+00:00",
  "target_components": [
    "model_registry",
    "audit_logs",
    "configs"
  ],
  "archive_filename": "BKP_20260926_210444.tar.gz",
  "archive_sha256": "4306b35a59520a5ff70f6c46db0142e1bd5d4cc52a97d481f3a296762cccf9e2",
  "file_count": 83,
  "total_size_bytes": 1419170,
  "is_verified": true,
  "metadata": {
    "operator_id": "PYTEST_RUNNER",
    "environment": "PRODUCTION"
  }
}