{
  "backup_id": "BKP_20260926_210324",
  "created_at": "2026-09-26T21:03:24.504221+00:00",
  "target_components": [
    "model_registry",
    "audit_logs",
    "configs"
  ],
  "archive_filename": "BKP_20260926_210324.tar.gz",
  "archive_sha256": "27c2deece0f733bc70dde57bf586b36e1900c08447c026fbc41323025859cd0f",
  "file_count": 83,
  "total_size_bytes": 1408135,
  "is_verified": true,
  "metadata": {
    "operator_id": "PYTEST_RUNNER",
    "environment": "PRODUCTION"
  }
}