{
  "backup_id": "BKP_20260927_030553",
  "created_at": "2026-09-27T03:05:53.555924+00:00",
  "target_components": [
    "model_registry",
    "audit_logs",
    "configs"
  ],
  "archive_filename": "BKP_20260927_030553.tar.gz",
  "archive_sha256": "a02d407a818cd8312509f4096af1fd46b479a407a822bbd7d4385cbc681f2f37",
  "file_count": 83,
  "total_size_bytes": 1441316,
  "is_verified": true,
  "metadata": {
    "operator_id": "PYTEST_RUNNER",
    "environment": "PRODUCTION"
  }
}