{
  "backup_id": "BKP_20260927_031349",
  "created_at": "2026-09-27T03:13:49.155863+00:00",
  "target_components": [
    "model_registry",
    "audit_logs",
    "configs"
  ],
  "archive_filename": "BKP_20260927_031349.tar.gz",
  "archive_sha256": "ce9dbc7daf609ef5d699c5740abcd73f409720c3704d6b4114a42c79df1e2e75",
  "file_count": 84,
  "total_size_bytes": 1452835,
  "is_verified": true,
  "metadata": {
    "operator_id": "PYTEST_RUNNER",
    "environment": "PRODUCTION"
  }
}