{
  "backup_id": "BKP_20260926_210933",
  "created_at": "2026-09-26T21:09:33.201907+00:00",
  "target_components": [
    "model_registry",
    "audit_logs",
    "configs"
  ],
  "archive_filename": "BKP_20260926_210933.tar.gz",
  "archive_sha256": "bfa3a51bafbd3228af6800df92d30ca2daaa9d5ab3966c4d240a484f5a4cdcae",
  "file_count": 83,
  "total_size_bytes": 1428757,
  "is_verified": true,
  "metadata": {
    "operator_id": "PYTEST_RUNNER",
    "environment": "PRODUCTION"
  }
}