{
  "backup_id": "BKP_20260927_035251",
  "created_at": "2026-09-27T03:52:51.861604+00:00",
  "target_components": [
    "model_registry",
    "audit_logs",
    "configs"
  ],
  "archive_filename": "BKP_20260927_035251.tar.gz",
  "archive_sha256": "f0eb3f378d6fde134b3f5d5f8c7613687579c50e63c43055e22d22de60a01f95",
  "file_count": 84,
  "total_size_bytes": 1475285,
  "is_verified": true,
  "metadata": {
    "operator_id": "PYTEST_RUNNER",
    "environment": "PRODUCTION"
  }
}