{
  "backup_id": "BKP_20260927_033143",
  "created_at": "2026-09-27T03:31:43.275473+00:00",
  "target_components": [
    "model_registry",
    "audit_logs",
    "configs"
  ],
  "archive_filename": "BKP_20260927_033143.tar.gz",
  "archive_sha256": "dff9b02fd7b76458e370efb44e9272cfb9216fbd07f1b26318ddb53beb8e30c9",
  "file_count": 84,
  "total_size_bytes": 1464732,
  "is_verified": true,
  "metadata": {
    "operator_id": "PYTEST_RUNNER",
    "environment": "PRODUCTION"
  }
}