{
  "backup_id": "BKP_20260926_210417",
  "created_at": "2026-09-26T21:04:17.712741+00:00",
  "target_components": [
    "model_registry",
    "audit_logs",
    "configs"
  ],
  "archive_filename": "BKP_20260926_210417.tar.gz",
  "archive_sha256": "8d84f0dd7c1e5b685233a1747de26a9bf82ef7633f553c53749c10e9c764db52",
  "file_count": 83,
  "total_size_bytes": 1409583,
  "is_verified": true,
  "metadata": {
    "operator_id": "PYTEST_RUNNER",
    "environment": "PRODUCTION"
  }
}